{
  "receipt_id": "01ARZ3NDEKTSV4RRFFQ69G5RCP",
  "query_digest": "sha256:2b4d6c8a0e1f3b5d7c9a2e4f6b8d0c1a3f5e7d9b1c3a5e7f9b2d4c6a8e0f1b3d",
  "status": "released",
  "cohort": {
    "protocol_ref": "inference-api/latency@1",
    "filters": { "concurrency": 1, "model.reported": "stub-model", "cache_disabled": true },
    "orgs": "3-5",
    "runs": "6-10"
  },
  "calculation_version": "latency-summary/1",
  "policy_version": "pilot-disclosure/1",
  "evidence_revision": 42,
  "result": {
    "findings": [
      {
        "claim": "latency_distribution",
        "ttft_ms": { "p50": 21.0, "p90": 24.0, "p95": 25.0, "p99": 27.0 },
        "total_ms": { "p50": 31.0, "p90": 35.0, "p95": 36.0, "p99": 38.0 }
      }
    ],
    "applicability": { "matched_required_context": 6, "of": 6 },
    "distributions": { "runs_per_org": "1-3" },
    "missingness": { "client_region": "2-3 runs unknown" },
    "contradictions": [],
    "uncertainty": { "kind": "range", "detail": "p50 across contributing runs spans 18-25 ms" },
    "freshness": { "newest_run_at": "2026-09-05T11:00:00Z" },
    "limitations": ["all contributing runs used a fixture target"]
  },
  "issued_at": "2026-09-05T12:30:00Z"
}
